{
  "id": "secret-ref-demo",
  "provider": "doppler",
  "connection_id": "connection-demo",
  "project_id": "project-demo",
  "environment_id": "environment-dev",
  "locator": {
    "provider_project": "sample-app",
    "provider_environment": "dev_agent",
    "item": "DATABASE_URL"
  },
  "expose_to_agent": false
}
